{
  "$schema": "https://json-schema.org/draft/2020-12/schema",
  "$id": "https://raw.githubusercontent.com/corvus-dotnet/corvus-regex-ecma262-benchmarks/main/schema/results.schema.json",
  "title": "A source's benchmark data file",
  "description": "The data file a source's image writes to /out/industry.json, in the results-page shape the central benchmark page merges (README.md, The results contract; site/generate_site.py). tools/merge.py also checks what a schema cannot say: that implementation ids are unique, that results name only implementations in impls, and that an exclusion of an encoding names the encoding the judge has no calls in.",
  "type": "object",
  "required": ["meta", "measures", "impls", "schemas", "results"],
  "properties": {
    "meta": { "$ref": "#/$defs/meta" },
    "vocab": { "$ref": "#/$defs/vocab" },
    "measures": {
      "description": "The figures to compare on, in order, by key. A result's parts are named by a measure's parts.",
      "type": "object",
      "minProperties": 1,
      "additionalProperties": { "$ref": "#/$defs/measure" }
    },
    "impls": {
      "description": "The engines the image measures (its own and the platform's others) and V8.",
      "type": "array",
      "minItems": 1,
      "items": { "$ref": "#/$defs/impl" }
    },
    "schemas": {
      "description": "The Industry workloads, by the names the .NET repository's workloads.py gives them.",
      "type": "array",
      "items": { "$ref": "#/$defs/workload" }
    },
    "results": {
      "description": "Each engine's result for each workload, by implementation id and then by workload name. A workload an engine has no entry for was not run.",
      "type": "object",
      "additionalProperties": {
        "type": "object",
        "additionalProperties": { "$ref": "#/$defs/result" }
      }
    }
  },
  "$defs": {
    "meta": {
      "description": "The run, as the harness recorded it (never typed in). Harnesses may add facts of their own (start, host, runtime, job, versions and so on).",
      "type": "object",
      "properties": {
        "title": { "type": "string" },
        "lede": { "type": "string", "description": "One paragraph under the title." },
        "repo": { "type": "string", "pattern": "^[^/\\s]+/[^/\\s]+$", "description": "owner/name of the engine repository." },
        "commit": { "type": "string", "description": "The commit the image was built from." },
        "date": {
          "description": "When the run was made: an ISO 8601 date-time with its zone, or a date (taken as UTC).",
          "type": "string",
          "anyOf": [
            { "format": "date-time", "pattern": "^\\d{4}-\\d{2}-\\d{2}T\\d{2}:\\d{2}(:\\d{2}(\\.\\d+)?)?(Z|[+-]\\d{2}:\\d{2})$" },
            { "format": "date", "pattern": "^\\d{4}-\\d{2}-\\d{2}$" }
          ]
        },
        "runUrl": { "type": "string", "description": "The workflow run's URL, or empty." },
        "runner": { "type": "string", "description": "The machine. The page reads it from here, or from a fact named Host or Runner." },
        "runs": { "type": "integer", "minimum": 0, "description": "The runs each measurement has." },
        "facts": {
          "description": "Shown in the run header, in order.",
          "type": "array",
          "items": { "type": "array", "prefixItems": [{ "type": "string" }, { "type": "string" }], "minItems": 2, "maxItems": 2 }
        },
        "links": {
          "description": "Related pages, shown in the run header.",
          "type": "array",
          "items": {
            "type": "object",
            "required": ["label", "url"],
            "properties": { "label": { "type": "string" }, "url": { "type": "string" } }
          }
        },
        "icon": { "type": "string" },
        "defaultMeasure": { "type": "string" },
        "method": { "type": "string", "description": "The 'How to read this' section, as HTML." }
      }
    },
    "vocab": {
      "description": "The words the page uses for its two axes and its figures.",
      "type": "object",
      "additionalProperties": { "type": "string" }
    },
    "measure": {
      "type": "object",
      "required": ["parts"],
      "properties": {
        "label": { "type": "string" },
        "long": { "type": "string", "description": "What the figure is, such as 'time per Count'. Time is in nanoseconds." },
        "parts": {
          "description": "The parts of a result summed to make the figure.",
          "type": "array",
          "minItems": 1,
          "items": { "type": "string", "minLength": 1 }
        },
        "bytes": { "type": "boolean", "description": "True for a measure in bytes, which may be 0." }
      }
    },
    "impl": {
      "type": "object",
      "required": ["id"],
      "properties": {
        "id": { "type": "string", "minLength": 1, "description": "Unique in the file; the key of its results." },
        "name": { "type": "string" },
        "group": { "type": "string", "description": "The language (the merge replaces it with the source's), or V8." },
        "version": { "type": "string" },
        "compliance": {
          "description": "The engine's result on the ECMA-262 test data, or \"not ECMA-262\" for an engine of another dialect.",
          "oneOf": [
            { "const": "not ECMA-262" },
            { "$ref": "#/$defs/compliance" }
          ]
        }
      }
    },
    "compliance": {
      "description": "The counts the data-set runner wrote (its --compliance file), with how it judged and what it leaves out. The page shows right answers over every answer the pinned test data asks in the encodings judged. encodings, grammars and unicode are worked out by the merge, so a runner never gives them.",
      "type": "object",
      "required": ["right", "wrong", "refused", "acceptedInvalid", "limited", "judge", "excludes"],
      "properties": {
        "right": { "$ref": "#/$defs/count" },
        "wrong": { "$ref": "#/$defs/count" },
        "refused": { "$ref": "#/$defs/count" },
        "acceptedInvalid": { "$ref": "#/$defs/count" },
        "limited": { "$ref": "#/$defs/count", "description": "Answers the engine never gave: a limit, a crash, a hang or a worker that gave up." },
        "judge": {
          "type": "object",
          "required": ["runner", "calls"],
          "properties": {
            "runner": { "type": "string", "pattern": "^https://", "description": "The runner's address." },
            "calls": {
              "description": "The calls the runner makes, in each encoding it asks in.",
              "type": "object",
              "minProperties": 1,
              "propertyNames": { "enum": ["utf16", "utf8"] },
              "additionalProperties": {
                "type": "array",
                "minItems": 1,
                "items": { "type": "string", "minLength": 1 }
              }
            }
          }
        },
        "excludes": {
          "description": "What the runner leaves out, at most one of each kind, each shown on the page as a badge.",
          "type": "array",
          "items": { "$ref": "#/$defs/exclusion" }
        },
        "dataCommit": {
          "description": "For counts checked in beside a harness, the commit of the test data they were made at: a full commit, or a prefix of at least 7 of the night's pinned commit.",
          "type": "string",
          "pattern": "^[0-9a-fA-F]{7,40}$"
        },
        "encodings": false,
        "grammars": false,
        "unicode": false,
        "note": false
      }
    },
    "count": { "type": "integer", "minimum": 0 },
    "exclusion": {
      "type": "object",
      "required": ["class"],
      "properties": { "class": { "enum": ["encoding", "grammar", "unicode", "operations"] } },
      "oneOf": [
        {
          "properties": { "class": { "const": "encoding" }, "leaves": { "enum": ["utf16", "utf8"] } },
          "required": ["leaves"]
        },
        {
          "properties": {
            "class": { "const": "grammar" },
            "leaves": {
              "description": "Not every grammar: at least one is judged.",
              "type": "array", "minItems": 1, "maxItems": 2, "uniqueItems": true,
              "items": { "enum": ["legacy", "unicode", "unicode_sets"] }
            }
          },
          "required": ["leaves"]
        },
        {
          "properties": {
            "class": { "const": "unicode" },
            "version": {
              "description": "The version of Unicode the engine's tables are.",
              "type": ["string", "number"],
              "pattern": "^\\d+(\\.\\d+){0,2}$"
            }
          },
          "required": ["version"]
        },
        {
          "properties": {
            "class": { "const": "operations" },
            "leaves": {
              "type": "array", "minItems": 1, "uniqueItems": true,
              "items": { "enum": ["global", "sticky", "replace", "split"] }
            }
          },
          "required": ["leaves"]
        }
      ]
    },
    "workload": {
      "type": "object",
      "required": ["name"],
      "properties": {
        "name": { "type": "string" },
        "note": { "type": "string" },
        "meta": {
          "type": "array",
          "items": { "type": "array", "prefixItems": [{ "type": "string" }, { "type": "string" }], "minItems": 2, "maxItems": 2 }
        },
        "url": { "type": "string" },
        "urlLabel": { "type": "string" }
      }
    },
    "result": {
      "description": "null: a failure. {limit}: no result within that many seconds. {wrongCount}: a count of matches other than V8's, a wrong answer whatever the engine. {error}: any other failure, with what the harness said. Otherwise a figure: each part of the measure, as every run's value or a summary.",
      "oneOf": [
        { "type": "null" },
        {
          "type": "object",
          "required": ["limit"],
          "properties": { "limit": { "type": "number", "exclusiveMinimum": 0 } },
          "additionalProperties": false
        },
        {
          "type": "object",
          "required": ["wrongCount"],
          "properties": {
            "wrongCount": {
              "type": "object",
              "required": ["counted", "v8"],
              "properties": { "counted": { "$ref": "#/$defs/count" }, "v8": { "$ref": "#/$defs/count" } },
              "additionalProperties": false
            }
          },
          "additionalProperties": false
        },
        {
          "type": "object",
          "required": ["error"],
          "properties": { "error": { "type": "string" } },
          "additionalProperties": false
        },
        {
          "description": "A figure, by part name.",
          "type": "object",
          "minProperties": 1,
          "propertyNames": { "not": { "enum": ["limit", "wrongCount", "error"] } },
          "additionalProperties": {
            "oneOf": [
              { "type": "array", "minItems": 1, "items": { "type": "number", "minimum": 0 } },
              {
                "type": "object",
                "required": ["median", "min", "max"],
                "properties": {
                  "median": { "type": "number", "minimum": 0 },
                  "min": { "type": "number", "minimum": 0 },
                  "max": { "type": "number", "minimum": 0 }
                }
              }
            ]
          }
        }
      ]
    }
  }
}
